{
  "bus": {
    "baud": 9600,
    "bits": 8,
    "endian": "L",
    "parity": "N",
    "stop": 1
  },
  "deviceClass": "refrigeration-controller",
  "family": "sync",
  "model": "Sync Controller",
  "profileId": "embraco-modbus-sync-v1.0.0",
  "protocol": "modbus-rtu",
  "quirks": {
    "bulkRead": {
      "count": 12,
      "start": 0
    }
  },
  "regs": [
    {
      "a": 0,
      "cat": 2,
      "fc": 3,
      "g": 5,
      "id": 1,
      "k": "t01",
      "l": "Hysteresis",
      "max": 99.9,
      "min": 1,
      "s": 0.1,
      "t": "i16",
      "u": 1,
      "w": 1,
      "wa": 0,
      "wfc": 6
    },
    {
      "a": 1,
      "cat": 2,
      "fc": 3,
      "g": 5,
      "id": 2,
      "k": "t00",
      "l": "Setpoint",
      "max": 99.9,
      "min": -99.9,
      "s": 0.1,
      "t": "i16",
      "u": 1,
      "w": 1,
      "wa": 1,
      "wfc": 6
    },
    {
      "a": 2,
      "cat": 1,
      "fc": 3,
      "g": 4,
      "id": 3,
      "k": "fc3_a2",
      "l": "I00 to I04 set as 2 - Cabinet",
      "s": 0.1,
      "t": "i16",
      "u": 1
    },
    {
      "a": 3,
      "cat": 1,
      "fc": 3,
      "g": 4,
      "id": 4,
      "k": "fc3_a3",
      "l": "I00 to I04 set as 4 - Condenser",
      "s": 0.1,
      "t": "i16",
      "u": 1
    },
    {
      "a": 4,
      "cat": 1,
      "fc": 3,
      "g": 4,
      "id": 5,
      "k": "fc3_a4",
      "l": "I00 to I04 set as 5 - Ambient",
      "s": 0.1,
      "t": "i16",
      "u": 1
    },
    {
      "a": 5,
      "cat": 1,
      "fc": 3,
      "g": 4,
      "id": 6,
      "k": "fc3_a5",
      "l": "I00 to I04 set as 6 - Door",
      "s": 0.1,
      "t": "i16",
      "u": 1
    },
    {
      "a": 6,
      "cat": 1,
      "fc": 3,
      "g": 4,
      "id": 7,
      "k": "fc3_a6",
      "l": "I00 to I04 set as 7 - Auxiliary",
      "s": 0.1,
      "t": "i16",
      "u": 1
    },
    {
      "a": 7,
      "cat": 1,
      "fc": 3,
      "g": 4,
      "id": 8,
      "k": "fc3_a7",
      "l": "I00 to I04 set as 8 - Evaporator 2",
      "s": 0.1,
      "t": "i16",
      "u": 1
    },
    {
      "a": 8,
      "cat": 5,
      "fc": 3,
      "g": 4,
      "id": 9,
      "k": "fc3_a8",
      "l": "Cooling control state (enum pending bench)",
      "t": "u16"
    },
    {
      "a": 9,
      "cat": 5,
      "fc": 3,
      "g": 4,
      "id": 10,
      "k": "fc3_a9",
      "l": "State of all relays (bit positions pending bench)",
      "t": "u16"
    },
    {
      "a": 10,
      "cat": 6,
      "fc": 3,
      "g": 4,
      "id": 11,
      "k": "fc3_a10",
      "l": "Compressor Speed (VCC) - ECv/ECm only",
      "t": "u16",
      "u": 16
    }
  ],
  "schema": 2,
  "vendor": "embraco"
}
